{
  "$schema": "http://json-schema.org/draft-07/schema#",
  "$id": "schema/events.schema.json",
  "title": "Live events",
  "description": "Shape contract for shared/data/events.json. Generated by tools/studio/gen-schemas.mjs — edit the generator, not this file.",
  "type": "object",
  "required": [
    "defaults",
    "seasonal",
    "version",
    "weeklyRecurring"
  ],
  "additionalProperties": false,
  "properties": {
    "$schema": {
      "type": "string"
    },
    "_comment": {
      "type": "string"
    },
    "defaults": {
      "type": "object",
      "properties": {
        "eventOverlapPolicy": {
          "type": "string"
        },
        "vipBaseChance": {
          "type": "number"
        },
        "vipMaxPerDay": {
          "type": "integer"
        }
      },
      "required": [
        "eventOverlapPolicy",
        "vipBaseChance",
        "vipMaxPerDay"
      ]
    },
    "seasonal": {
      "type": "array",
      "items": {
        "type": "object",
        "properties": {
          "adds": {
            "type": "array",
            "items": {
              "type": "string"
            }
          },
          "id": {
            "type": "string",
            "pattern": "^[a-z][a-z0-9_]*$"
          },
          "nameKey": {
            "type": "string"
          },
          "passId": {
            "type": "string"
          },
          "theme": {
            "type": "string"
          },
          "window": {
            "type": "object",
            "properties": {
              "anchor": {
                "type": "string"
              },
              "daysBefore": {
                "type": "integer"
              },
              "durationDays": {
                "type": "integer"
              },
              "startDay": {
                "type": "integer"
              },
              "startMonth": {
                "type": "integer"
              },
              "type": {
                "enum": [
                  "fixed",
                  "relative"
                ]
              }
            },
            "required": [
              "durationDays",
              "type"
            ]
          }
        },
        "required": [
          "adds",
          "id",
          "nameKey",
          "theme",
          "window"
        ]
      }
    },
    "version": {
      "type": "integer"
    },
    "weeklyRecurring": {
      "type": "array",
      "items": {
        "type": "object",
        "properties": {
          "dayOfWeek": {
            "enum": [
              "monday",
              "saturday",
              "tuesday",
              "wednesday"
            ]
          },
          "descKey": {
            "enum": [
              "event.fds_brasa.desc",
              "event.quarta_espetinho.desc",
              "event.segunda_linguica.desc",
              "event.terca_picanha.desc"
            ]
          },
          "durationHours": {
            "type": "integer"
          },
          "id": {
            "enum": [
              "fds_brasa",
              "quarta_espetinho",
              "segunda_linguica",
              "terca_picanha"
            ]
          },
          "modifiers": {
            "type": "array",
            "items": {
              "type": "object",
              "properties": {
                "category": {
                  "type": "string"
                },
                "ingredient": {
                  "type": "string"
                },
                "type": {
                  "enum": [
                    "categoryBoost",
                    "globalTipBoost",
                    "ingredientBoost",
                    "vipChance"
                  ]
                },
                "valueAdd": {
                  "type": "number"
                },
                "valueMult": {
                  "type": "number"
                },
                "xpMult": {
                  "type": "number"
                }
              },
              "required": [
                "type"
              ]
            }
          },
          "nameKey": {
            "enum": [
              "event.fds_brasa.name",
              "event.quarta_espetinho.name",
              "event.segunda_linguica.name",
              "event.terca_picanha.name"
            ]
          },
          "objective": {
            "type": "object",
            "properties": {
              "goal": {
                "type": "integer"
              },
              "stat": {
                "enum": [
                  "category.skewer.served",
                  "customersServed",
                  "food.linguica_toscana.served",
                  "food.picanha.perfect"
                ]
              }
            },
            "required": [
              "goal",
              "stat"
            ]
          },
          "rewards": {
            "type": "array",
            "items": {
              "type": "object",
              "properties": {
                "milestone": {
                  "type": "integer"
                },
                "reward": {
                  "type": "object",
                  "properties": {
                    "coins": {
                      "type": "integer"
                    },
                    "embers": {
                      "type": "integer"
                    }
                  }
                }
              },
              "required": [
                "milestone",
                "reward"
              ]
            }
          }
        },
        "required": [
          "dayOfWeek",
          "descKey",
          "durationHours",
          "id",
          "modifiers",
          "nameKey",
          "objective",
          "rewards"
        ]
      }
    }
  }
}
